"Название бренда";"URL имя";Публичный;Описание;"Сортировочный номер";Заголовок;"Ключевые слова";Описание;Изображение
Panasonic;panasonic;1;"<p>Крупная японская машиностроительная корпорация, один из крупнейших в мире производителей бытовой техники и электронных товаров. Штаб-квартира &mdash; в городе Кадома префектуры Осака (Япония). В 2011 году компания заняла 50-е место по объёму выручки в глобальном рейтинге компаний Fortune Global 500.</p>
<p>До 1 октября 2008 года носила название Matsushita Electric Industrial Co., Ltd. Panasonic (как и National, National Panasonic, Technics, Quasar) была одной из торговых марок этой компании.</p>
<p>С момента образования в 1918 году, компания была известна как Matsushita Electric Housewares Manufacturing Works, которое было изменено на Matsushita Electric Manufacturing Works в 1929 году. Название Matsushita Electric Industrial Co., Ltd. компания носила с 1935 года, когда она стала акционерной корпорацией. Хотя компания использовала бренды Panasonic и National в течение длительного времени, в 2003 году было решено, что бренд &laquo;Панасоник&raquo; станет в качестве глобального бренда для усиления конкурентоспособности на мировом рынке наряду со своим слоганом&nbsp;&mdash; &laquo;Panasonic ideas for life&raquo;.</p>
<p>С начала 60-х годов XX века компании принадлежал контрольный пакет акций компании JVC (Victor Company of Japan, Limited), разработчика стандарта бытового видео VHS. В 2007 году компания продала контрольный пакет компании JVC группе инвесторов.</p>
<p>С 1 октября <span class=""mw-redirect"">2008</span> компания Matsushita Electric Industrial Co., Ltd. поменяла название на Panasonic Corporation. Переименованию были подвержены все бренды компании, в названиях которых присутствовали названия Matsushita или National. Наряду с изменением названия, компания работает над полным переходом бренда National на Panasonic в Японии, которое должно завершиться к марту 2010 года.</p>
<p>В марте 2011 года генеральный директор компании Дзюнъитиро Китагава отметил, что в результате землетрясения в Японии пострадало три завода компании, что, возможно, скажется на продаже цифровых аппаратов.</p>
<p>Источник - wikipedia.org</p>";7;;;;/modules/catalog/config/demo/images/panasonic.png
Samsung;samsung;1;"<p>Южнокорейская группа компаний, один из крупнейших в Южной Корее чеболей, основанный в 1938 году. На мировом рынке известен как производитель высокотехнологичных компонентов, телекоммуникационного оборудования, бытовой техники, аудио- и видеоустройств. Штаб-квартира в Сеуле.<br /><br />Слово &laquo;Самсунг&raquo; в корейском языке означает &laquo;три звезды&raquo;. Возможна связь такого названия с тремя сыновьями основателя Samsung Ли Бёнчхоля, младший из которых Ли Гонхи (иногда его имя пишется Ли Кун Хи &mdash; калька с английского: Lee Kun-hee) возглавил компанию в 1987 году в нарушение всех восточных традиций наследования, в согласии с которыми старший сын наследует большую часть семейной собственности.</p>
<p>В <span class=""mw-redirect"">1930-х годах</span> в Корее предприниматель Ли Бёнчхоль открывает своё дело по производству рисовой муки. Небольшой склад в городе Тэгу становится началом большой истории компании Samsung. В это время Корея являлась колонией Японии, и в стране было довольно сложно заниматься частным предпринимательством. Тем не менее, уже в 1938 году Ли удаётся создать первый независимый канал для экспорта из Кореи в <span class=""mw-redirect"">Китай</span> и Маньчжурию. Активное развитие поставок пищевых продуктов, таких как рис, сахар и сушёная рыба, дало возможность официально зарегистрировать торговую марку Samsung Trading Company. Иностранное (для Кореи) происхождение названия явилось следствием далеко идущих, амбициозных планов корейского предпринимателя: уже к концу <span class=""mw-redirect"">1950-х годов</span> Ли Бён собирался наладить торговлю со странами Американского континента. А после высадки войск США на Корейском полуострове продукция завода по производству рисовой водки и пива стала продаваться представителям союзных войск. <span class=""mw-redirect"">Война в Корее</span> положила конец этому бизнесу. Склады были разграблены и сожжены так же, как и основные заводы компании.</p>
<p>Источник - wikipedia.org</p>";12;;;;/modules/catalog/config/demo/images/samsung.png
Sony;sony;1;"<p>Корпорация &laquo;Sony&raquo; была основана Акио Моритой и Масару Ибукой 7 мая 1946 года. В самом начале она называлась &laquo;Токё цусин когё кабусики-гайся&raquo; (Токийская телекоммуникационно-промышленная компания) или сокращённо Тоцуко, но, как выяснил Акио Морита, это название тяжело произносить американцам. Нынешнее название &laquo;Сони&raquo; произошло от комбинации лат. sonus (&laquo;звук&raquo;) и англ. sunny boys (&laquo;солнечные ребята&raquo;; в варианте англ. sonny-boys приобрело в японском значение &laquo;малолетние гении&raquo;); кроме того, Морита старался найти слово, которого нет ни в одном языке мира. Поскольку в японском звуки &laquo;сонни&raquo; напоминают слово, обозначающее неуспешный бизнес, было решено убрать одну из букв n.<br /><br />Морита возглавлял компанию долгое время, отвечал за маркетинг и продажи и сумел привести её к огромному успеху на рынке. Sony сделала своё имя на хорошем и привлекательном дизайне и новшествах. Особенную роль компания уделяла уменьшению размеров своих изделий.<br /><br />В 1950-е годы компания выпустила свой первый радиоприёмник &mdash; &laquo;TR-63&raquo;, эта новинка положила начало успеху компании. Приемник, хоть и назывался карманным и действительно был маленьким, в карман обычной мужской рубашки не влезал. Для коммивояжеров компания сшила специальные рубашки с увеличенными карманами, что бы они могли при продаже продемонстрировать, как легко туда входит приемник.</p>
<p>Источник - wikipedia.org</p>";13;;;;/modules/catalog/config/demo/images/sony.png
